{
    "adhoc": {
        "batch_size": 64,
        "epochs": 3
    },
    "attack": {
        "budget": null,
        "knowledge": "white",
        "kwargs": {
            "eps": 0.2
        },
        "module": "art.attacks",
        "name": "FastGradientMethod"
    },
    "dataset": {
        "module": "armory.data.datasets",
        "name": "mnist"
    },
    "defense": null,
    "evaluation": {
        "eval_file": "armory-example.evaluations.fgm_attack"
    },
    "metric": null,
    "model": {
        "model_kwargs": {},
        "module": "armory.baseline_models.keras.keras_mnist",
        "name": "get_art_model",
        "wrapper_kwargs": {
            "clip_values": [
                0,
                1
            ]
        }
    },
    "sysconfig": {
        "docker_image": "twosixarmory/tf1:0.5.0",
        "external_github_repo": "twosixlabs/armory-example",
        "use_gpu": false
    }
}
