{
    "adhoc": {
        "train_epochs": 10
    },
    "attack": {
        "budget": null,
        "knowledge": "white",
        "kwargs": {
            "eps": 51.0
        },
        "module": "art.attacks",
        "name": "FastGradientMethod"
    },
    "dataset": {
        "batch_size": 16,
        "module": "armory.data.datasets",
        "name": "ucf101"
    },
    "defense": null,
    "evaluation": {
        "eval_file": "armory.scenarios.ucf101_scenario"
    },
    "metric": null,
    "model": {
        "model_kwargs": {
            "model_status": "ucf101_trained"
        },
        "module": "armory.baseline_models.pytorch.ucf101_mars",
        "name": "get_art_model",
        "weights_file": "MARS_UCF101_16f.pth",
        "wrapper_kwargs": {}
    },
    "sysconfig": {
        "docker_image": "twosixarmory/pytorch:0.6.0-dev",
        "external_github_repo": "davidslater/MARS",
        "use_gpu": false
    }
}
