{
    "adhoc": {
        "epochs": 120,
        "num_attacked_pts": 100,
        "num_classes": 40,
        "seed": 123
    },
    "attack": {
        "budget": {
            "norm": [
                "L2"
            ]
        },
        "knowledge": "white",
        "kwargs": {
            "targeted": false
        },
        "module": "art.attacks",
        "name": "ProjectedGradientDescent"
    },
    "dataset": {
        "module": "armory.data.datasets",
        "name": "librispeech_dev_clean",
        "batch_size": 16
    },
    "defense": null,
    "evaluation": {
        "eval_file": "tests.evals.raw_audio_scenario"
    },
    "metric": null,
    "model": {
        "model_kwargs": {
            "pretrained": true,
            "model_file": "model_sincnet.pkl"
        },
        "module": "armory.baseline_models.pytorch.sincnet",
        "name": "get_art_model",
        "wrapper_kwargs": {}
    },
    "sysconfig": {
        "docker_image": "twosixarmory/pytorch:0.6.0-dev",
        "external_github_repo": "hkakitani/SincNet",
        "use_gpu": true
    }
}